<?xml version="1.0" standalone="no"?>

<!DOCTYPE serverinfo SYSTEM "serverinfo.dtd">

<!--
 Copyright (c) 2006 Apple Computer, Inc. All rights reserved.

 Licensed under the Apache License, Version 2.0 (the "License");
 you may not use this file except in compliance with the License.
 You may obtain a copy of the License at

  http://www.apache.org/licenses/LICENSE-2.0

 Unless required by applicable law or agreed to in writing, software
 distributed under the License is distributed on an "AS IS" BASIS,
 WITHOUT WARRANTIES OR CONDITIONS OF ANY KIND, either express or implied.
 See the License for the specific language governing permissions and
 limitations under the License.

 DRI: Cyrus Daboo, cdaboo@apple.com
 -->

<serverinfo>
	<host>localhost</host>
	<port>8008</port>
	<substitutions>
		<substitution>
			<key>$host:</key>
			<value>http://localhost:8008</value>
		</substitution>

		<!-- relative path to principal collection-->
		<substitution>
			<key>$principals:</key>
			<value>/principals/user/</value>
		</substitution>

		<!-- relative path to resource principal collection-->
		<substitution>
			<key>$resources:</key>
			<value>/principals/resource/</value>
		</substitution>

		<!-- user id for admin user -->
		<substitution>
			<key>$useradmin:</key>
			<value>admin</value>
		</substitution>
		<!-- password for admin user -->
		<substitution>
			<key>$pswdadmin:</key>
			<value>admin</value>
		</substitution>
		<!-- relative path to admin principal resource-->
		<substitution>
			<key>$principaladmin:</key>
			<value>/principals/user/admin</value>
		</substitution>

		<!-- relative path to principal collection-->
		<substitution>
			<key>$principals:</key>
			<value>/principals/user/</value>
		</substitution>

		<!-- relative path to first user principal resource-->
		<substitution>
			<key>$userid1:</key>
			<value>user01</value>
		</substitution>
		<!-- password for first user -->
		<substitution>
			<key>$pswd1:</key>
			<value>user01</value>
		</substitution>
		<!-- relative path to first user principal resource-->
		<substitution>
			<key>$principal:</key>
			<value>/principals/user/user01</value>
		</substitution>
		<!-- relative path to first user calendar home-->
		<substitution>
			<key>$pathprefix:</key>
			<value>/calendars/user/user01</value>
		</substitution>
		<!-- relative path to first user calendar home-->
		<substitution>
			<key>$calendarpath1:</key>
			<value>/calendars/user/user01/calendar</value>
		</substitution>
		<!-- calendar user address of first user-->
		<substitution>
			<key>$cuaddr1:</key>
			<value>mailto:user01@example.com</value>
		</substitution>
		
		<!-- user id for second user -->
		<substitution>
			<key>$userid2:</key>
			<value>user02</value>
		</substitution>
		<!-- password for second user -->
		<substitution>
			<key>$pswd2:</key>
			<value>user02</value>
		</substitution>
		<!-- relative path to second user principal resource-->
		<substitution>
			<key>$principal2:</key>
			<value>/principals/user/user02</value>
		</substitution>
		<!-- relative path to second user calendar home-->
		<substitution>
			<key>$pathprefix2:</key>
			<value>/calendars/user/user02</value>
		</substitution>
		<!-- calendar user address of second user-->
		<substitution>
			<key>$cuaddr2:</key>
			<value>mailto:user02@example.com</value>
		</substitution>
		
		<!-- user id for third user -->
		<substitution>
			<key>$userid3:</key>
			<value>user03</value>
		</substitution>
		<!-- password for third user -->
		<substitution>
			<key>$pswd3:</key>
			<value>user03</value>
		</substitution>
		<!-- relative path to third user principal resource-->
		<substitution>
			<key>$principal3:</key>
			<value>/principals/user/user03</value>
		</substitution>
		<!-- relative path to third user calendar home-->
		<substitution>
			<key>$pathprefix3:</key>
			<value>/calendars/user/user03</value>
		</substitution>
		<!-- calendar user address of third user-->
		<substitution>
			<key>$cuaddr3:</key>
			<value>mailto:user03@example.com</value>
		</substitution>

		<!-- relative path to first resource calendar home-->
		<substitution>
			<key>$rpathprefix1:</key>
			<value>/calendars/resource/resource01</value>
		</substitution>
		<!-- relative path to first resource principal resource-->
		<substitution>
			<key>$rprincipal1:</key>
			<value>/principals/resource/resource01</value>
		</substitution>
	</substitutions>
	<serverfilepath>/Users/cyrusdaboo/Documents/Development/Apple/eclipse/CalendarServer/twistedcaldav/test/data/</serverfilepath>
</serverinfo>
